Nasdaq Traded,Symbol,Security Name,Listing Exchange,Market Category,ETF,Round Lot Size,Test Issue,Financial Status,CQS Symbol,NASDAQ Symbol,NextShares
Y,PJP,Invesco Dynamic Pharmaceuticals ETF,P, ,Y,100.0,N,,PJP,PJP,N
Y,PJUL,Innovator S&P 500 Power Buffer ETF - July,Z, ,Y,100.0,N,,PJUL,PJUL,N
Y,PJUN,Innovator S&P 500 Power Buffer ETF - June,Z, ,Y,100.0,N,,PJUN,PJUN,N
Y,PKB,Invesco Dynamic Building & Construction ETF,P, ,Y,100.0,N,,PKB,PKB,N
Y,PKW,Invesco BuyBack Achievers ETF,Q,G,Y,100.0,N,N,,PKW,N
Y,PLAT,WisdomTree Modern Tech Platforms Fund,P, ,Y,100.0,N,,PLAT,PLAT,N
Y,PLC,Principal U.S. Large-Cap Multi-Factor Core Index ETF,Q,G,Y,100.0,N,N,,PLC,N
Y,PLCY,EventShares U.S. Legislative Opportunities ETF,Z, ,Y,100.0,N,,PLCY,PLCY,N
Y,PLTM,GraniteShares Platinum Shares ETF,P, ,Y,100.0,N,,PLTM,PLTM,N
Y,PLW,Invesco 1-30 Laddered Treasury ETF,Q,G,Y,100.0,N,N,,PLW,N
Y,PMAR,Innovator S&P 500 Power Buffer ETF - March,Z, ,Y,100.0,N,,PMAR,PMAR,N
Y,PMOM,Principal Sustainable Momentum Index ETF,Q,G,Y,100.0,N,N,,PMOM,N
Y,PNOV,Innovator S&P 500 Power Buffer ETF - November,Z, ,Y,100.0,N,,PNOV,PNOV,N
Y,PNQI,Invesco Nasdaq Internet ETF,Q,G,Y,100.0,N,N,,PNQI,N
Y,POCT,Innovator S&P 500 Power Buffer ETF - October,Z, ,Y,100.0,N,,POCT,POCT,N
Y,POTX,Global X Cannabis ETF,Q,G,Y,100.0,N,N,,POTX,N
Y,PPA,Invesco Aerospace & Defense ETF ,P, ,Y,100.0,N,,PPA,PPA,N
Y,PPDM,PortfolioPlus Developed Markets ETF,P, ,Y,100.0,N,,PPDM,PPDM,N
Y,PPEM,PortfolioPlus Emerging Markets ETF,P, ,Y,100.0,N,,PPEM,PPEM,N
Y,PPH,VanEck Vectors Pharmaceutical ETF,Q,G,Y,100.0,N,N,,PPH,N
Y,PPLC,PortfolioPlus S&P 500 ETF,P, ,Y,100.0,N,,PPLC,PPLC,N
Y,PPLT,Aberdeen Standard Physical Platinum Shares ETF,P, ,Y,100.0,N,,PPLT,PPLT,N
Y,PPMC,PortfolioPlus S&P Mid Cap ETF,P, ,Y,100.0,N,,PPMC,PPMC,N
Y,PPSC,PortfolioPlus S&P Small Cap ETF,P, ,Y,100.0,N,,PPSC,PPSC,N
Y,PPTY,PPTY U.S. Diversified Real Estate ETF,P, ,Y,100.0,N,,PPTY,PPTY,N
Y,PQIN,PGIM QMA Strategic Alpha International Equity ETF,P, ,Y,100.0,N,,PQIN,PQIN,N
Y,PQLC,PGIM QMA Strategic Alpha Large-Cap Core ETF,P, ,Y,100.0,N,,PQLC,PQLC,N
Y,PQSG,PGIM QMA Strategic Alpha Small-Cap Growth ETF,P, ,Y,100.0,N,,PQSG,PQSG,N
Y,PQSV,PGIM ETF Trust ETF PGIM QMA Strategic Alpha Small-Cap Value ETF,P, ,Y,100.0,N,,PQSV,PQSV,N
Y,PREF,Principal Spectrum Preferred Securities Active ETF,Z, ,Y,100.0,N,,PREF,PREF,N
Y,PRF,Invesco FTSE RAFI US 1000 ETF,P, ,Y,100.0,N,,PRF,PRF,N
Y,PRFZ,Invesco FTSE RAFI US 1500 Small-Mid ETF,Q,G,Y,100.0,N,N,,PRFZ,N
Y,PRN,Invesco DWA Industrials Momentum ETF,Q,G,Y,100.0,N,N,,PRN,N
Y,PRNT,3D Printing (The) ETF,Z, ,Y,100.0,N,,PRNT,PRNT,N
Y,PSC,Principal U.S. Small-Cap Multi-Factor Index ETF,Q,G,Y,100.0,N,N,,PSC,N
Y,PSCC,Invesco S&P SmallCap Consumer Staples ETF,Q,G,Y,100.0,N,N,,PSCC,N
Y,PSCD,Invesco S&P SmallCap Consumer Discretionary ETF,Q,G,Y,100.0,N,N,,PSCD,N
Y,PSCE,Invesco S&P SmallCap Energy ETF,Q,G,Y,100.0,N,N,,PSCE,N
Y,PSCF,Invesco S&P SmallCap Financials ETF,Q,G,Y,100.0,N,N,,PSCF,N
Y,PSCH,Invesco S&P SmallCap Health Care ETF,Q,G,Y,100.0,N,N,,PSCH,N
Y,PSCI,Invesco S&P SmallCap Industrials ETF,Q,G,Y,100.0,N,N,,PSCI,N
Y,PSCM,Invesco S&P SmallCap Materials ETF,Q,G,Y,100.0,N,N,,PSCM,N
Y,PSCT,Invesco S&P SmallCap Information Technology ETF,Q,G,Y,100.0,N,N,,PSCT,N
Y,PSCU,Invesco S&P SmallCap Utilities & Communication Services ETF,Q,G,Y,100.0,N,N,,PSCU,N
Y,PSEP,Innovator ETFs Trust Innovator S&P 500 Power Buffer ETF - September,Z, ,Y,100.0,N,,PSEP,PSEP,N
Y,PSET,Principal Price Setters Index ETF,Q,G,Y,100.0,N,N,,PSET,N
Y,PSI,Invesco Dynamic Semiconductors ETF,P, ,Y,100.0,N,,PSI,PSI,N
Y,PSJ,Invesco Dynamic Software ETF,P, ,Y,100.0,N,,PSJ,PSJ,N
Y,PSK,SPDR Wells Fargo Preferred Stock ETF,P, ,Y,100.0,N,,PSK,PSK,N
Y,PSL,Invesco DWA Consumer Staples Momentum ETF,Q,G,Y,100.0,N,N,,PSL,N
Y,PSLV,Sprott Physical Silver Trust ETV,P, ,Y,100.0,N,,PSLV,PSLV,N
Y,PSM,Principal U.S. Small-MidCap Multi-Factor Core Index ETF,Q,G,Y,100.0,N,N,,PSM,N
Y,PSMB,Invesco Balanced Multi-Asset Allocation ETF,Z, ,Y,100.0,N,,PSMB,PSMB,N
Y,PSMC,Invesco Conservative Multi-Asset Allocation ETF,Z, ,Y,100.0,N,,PSMC,PSMC,N
Y,PSMG,Invesco Growth Multi-Asset Allocation ETF,Z, ,Y,100.0,N,,PSMG,PSMG,N
Y,PSMM,Invesco Moderately Conservative Multi-Asset Allocation ETF,Z, ,Y,100.0,N,,PSMM,PSMM,N
Y,PSP,Invesco Global Listed Private Equity ETF,P, ,Y,100.0,N,,PSP,PSP,N
Y,PSQ,ProShares Short QQQ,P, ,Y,100.0,N,,PSQ,PSQ,N
Y,PSR,Invesco Active U.S. Real Estate Fund,P, ,Y,100.0,N,,PSR,PSR,N
Y,PST,ProShares UltraShort Lehman 7-10 Year Treasury,P, ,Y,100.0,N,,PST,PST,N
Y,PTBD,Pacer Trendpilot US Bond ETF,P, ,Y,100.0,N,,PTBD,PTBD,N
Y,PTEU,Pacer TrendpilotTM European Index ETF,Z, ,Y,100.0,N,,PTEU,PTEU,N
Y,PTF,Invesco DWA Technology Momentum ETF,Q,G,Y,100.0,N,N,,PTF,N
Y,PTH,Invesco DWA Healthcare Momentum ETF,Q,G,Y,100.0,N,N,,PTH,N
Y,PTIN,Pacer Trendpilot International ETF,P, ,Y,100.0,N,,PTIN,PTIN,N
Y,PTLC,Pacer Fund Trust Pacer Trendpilot US Large Cap ETF,Z, ,Y,100.0,N,,PTLC,PTLC,N
Y,PTMC,Pacer Trendpilot US Mid Cap ETF,Z, ,Y,100.0,N,,PTMC,PTMC,N
Y,PTNQ,Pacer Trendpilot 100 ETF,Z, ,Y,100.0,N,,PTNQ,PTNQ,N
Y,PUI,Invesco DWA Utilities Momentum ETF,Q,G,Y,100.0,N,N,,PUI,N
Y,PULS,PGIM Ultra Short Bond ETF,P, ,Y,100.0,N,,PULS,PULS,N
Y,PUTW,WisdomTree CBOE S&P 500 PutWrite Strategy Fund,P, ,Y,100.0,N,,PUTW,PUTW,N
Y,PVAL,Principal Contrarian Value Index ETF,Q,G,Y,100.0,N,N,,PVAL,N
Y,PVI,Invesco VRDO Tax Free Weekly ETF,P, ,Y,100.0,N,,PVI,PVI,N
Y,PWB,Invesco Dynamic Large Cap Growth ETF,P, ,Y,100.0,N,,PWB,PWB,N
Y,PWC,Invesco Dynamic Market ETF,P, ,Y,100.0,N,,PWC,PWC,N
Y,PWS,Pacer WealthShield ETF ,Z, ,Y,100.0,N,,PWS,PWS,N
Y,PWV,Invesco Dynamic Large Cap Value ETF,P, ,Y,100.0,N,,PWV,PWV,N
Y,PWZ,Invesco California AMT-Free Municipal Bond Portfolio,P, ,Y,100.0,N,,PWZ,PWZ,N
Y,PXE,Invesco Dynamic Energy Exploration &Production ETF,P, ,Y,100.0,N,,PXE,PXE,N
Y,PXF,Invesco FTSE RAFI Developed Markets ex-U.S. ETF,P, ,Y,100.0,N,,PXF,PXF,N
Y,PXH,Invesco FTSE RAFI Emerging Markets ETF,P, ,Y,100.0,N,,PXH,PXH,N
Y,PXI,Invesco DWA Energy Momentum ETF,Q,G,Y,100.0,N,N,,PXI,N
Y,PXJ,Invesco Dynamic Oil & Gas Services ETF,P, ,Y,100.0,N,,PXJ,PXJ,N
Y,PXQ,Invesco Dynamic Networking ETF,P, ,Y,100.0,N,,PXQ,PXQ,N
Y,PY,Principal Shareholder Yield Index ETF,Q,G,Y,100.0,N,N,,PY,N
Y,PYZ,Invesco DWA Basic Materials Momentum ETF,Q,G,Y,100.0,N,N,,PYZ,N
Y,PZA,Invesco National AMT-Free Municipal Bond ETFo,P, ,Y,100.0,N,,PZA,PZA,N
Y,PZD,Invesco Cleantech ETF,P, ,Y,100.0,N,,PZD,PZD,N
Y,PZT,Invesco New York AMT-Free Municipal Bond ETF,P, ,Y,100.0,N,,PZT,PZT,N
Y,QABA,First Trust NASDAQ ABA Community Bank Index Fund,Q,G,Y,100.0,N,N,,QABA,N
Y,QAI,IQ Hedge MultiIQ Hedge Multi-Strategy Tracker ETF,P, ,Y,100.0,N,,QAI,QAI,N
Y,QARP,Xtrackers Russell 1000 US Quality at a Reasonable Price ETF ETF,P, ,Y,100.0,N,,QARP,QARP,N
Y,QAT,iShares MSCI Qatar ETF,Q,G,Y,100.0,N,N,,QAT,N
Y,QCLN,First Trust NASDAQ Clean Edge Green Energy Index Fund,Q,G,Y,100.0,N,N,,QCLN,N
Y,QDEF,FlexShares Quality Dividend Defensive Index Fund,P, ,Y,100.0,N,,QDEF,QDEF,N
Y,QDF,FlexShares Quality Dividend Index Fund,P, ,Y,100.0,N,,QDF,QDF,N
Y,QDIV,Global X S&P 500 Quality Dividend ETF,P, ,Y,100.0,N,,QDIV,QDIV,N
Y,QDYN,FlexShares Quality Dynamic Index Fund,P, ,Y,100.0,N,,QDYN,QDYN,N
Y,QED,IQ Hedge Event-Driven Tracker ETF,P, ,Y,100.0,N,,QED,QED,N
Y,QEFA,SPDR MSCI EAFE StrategicFactors ETF,P, ,Y,100.0,N,,QEFA,QEFA,N
Y,QEMM,SPDR MSCI Emerging Markets StrategicFactors ETF,P, ,Y,100.0,N,,QEMM,QEMM,N
Y,QGRO,American Century STOXX U.S. Quality Growth ETF,P, ,Y,100.0,N,,QGRO,QGRO,N
Y,QGTA,IQ Leaders GTAA Tracker ETF,P, ,Y,100.0,N,,QGTA,QGTA,N
Y,QID,ProShares UltraShort QQQ,P, ,Y,100.0,N,,QID,QID,N
Y,QINT,American Century Quality Diversified International ETF,P, ,Y,100.0,N,,QINT,QINT,N
Y,QLC,FlexShares Trust FlexShares US Quality Large Cap Index Fund,Z, ,Y,100.0,N,,QLC,QLC,N
Y,QLD,ProShares Ultra QQQ,P, ,Y,100.0,N,,QLD,QLD,N
Y,QLS,IQ Hedge Long Short Tracker ETF,P, ,Y,100.0,N,,QLS,QLS,N
Y,QLTA,iShares Aaa A Rated Corporate Bond ETF,P, ,Y,100.0,N,,QLTA,QLTA,N
Y,QLV,FlexShares US Quality Low Volatility Index Fund,P, ,Y,100.0,N,,QLV,QLV,N
Y,QLVD,FlexShares Developed Markets ex-US Quality Low Volatility Index Fund,P, ,Y,100.0,N,,QLVD,QLVD,N
Y,QLVE,FlexShares Emerging Markets  Quality Low Volatility Index Fund,P, ,Y,100.0,N,,QLVE,QLVE,N
Y,QMJ,Direxion S&P 500 High minus Low Quality ETF,P, ,Y,100.0,N,,QMJ,QMJ,N
Y,QMN,IQ Hedge Market Neutral Tracker ETF,P, ,Y,100.0,N,,QMN,QMN,N
Y,QMOM,Alpha Architect U.S. Quantitative Momentum ETF,Z, ,Y,100.0,N,,QMOM,QMOM,N
Y,QQEW,First Trust NASDAQ-100 Equal Weighted Index Fund,Q,G,Y,100.0,N,N,,QQEW,N
Y,QQH,HCM Defender 100 Index ETF,P, ,Y,100.0,N,,QQH,QQH,N
Y,QQQ,"Invesco QQQ Trust, Series 1",Q,G,Y,100.0,N,N,,QQQ,N
Y,QQQE,Direxion NASDAQ-100 Equal Weighted Index Shares,P, ,Y,100.0,N,,QQQE,QQQE,N
Y,QQXT,First Trust NASDAQ-100 Ex-Technology Sector Index Fund,Q,G,Y,100.0,N,N,,QQXT,N
Y,QRFT,QRAFT AI-Enhanced U.S. Large Cap ETF,P, ,Y,100.0,N,,QRFT,QRFT,N
Y,QSY,WisdomTree U.S. Quality Shareholder Yield Fund,P, ,Y,100.0,N,,QSY,QSY,N
Y,QTEC,First Trust NASDAQ-100- Technology Index Fund,Q,G,Y,100.0,N,N,,QTEC,N
Y,QTUM,Defiance Quantum ETF,P, ,Y,100.0,N,,QTUM,QTUM,N
Y,QUAL,iShares Edge MSCI USA Quality Factor ETF,Z, ,Y,100.0,N,,QUAL,QUAL,N
Y,QUS,SPDR MSCI USA StrategicFactors ETF,P, ,Y,100.0,N,,QUS,QUS,N
Y,QVAL,Alpha Architect U.S. Quantitative Value ETF,Z, ,Y,100.0,N,,QVAL,QVAL,N
Y,QVM,Arrow QVM Equity Factor ETF,P, ,Y,100.0,N,,QVM,QVM,N
Y,QWLD,SPDR MSCI World StrategicFactors ETF,P, ,Y,100.0,N,,QWLD,QWLD,N
Y,QYLD,Global X NASDAQ-100 Covered Call ETF,Q,G,Y,100.0,N,N,,QYLD,N
Y,RAAX,VanEck Vectors Real Asset Allocation ETF,P, ,Y,100.0,N,,RAAX,RAAX,N
Y,RAFE,PIMCO RAFI ESG U.S. ETF,P, ,Y,100.0,N,,RAFE,RAFE,N
Y,RALS,ProShares RAFI Long Short ETF,P, ,Y,100.0,N,,RALS,RALS,N
Y,RAVI,FlexShares Ready Access Variable Income Fund,P, ,Y,100.0,N,,RAVI,RAVI,N
Y,RBIN,Nationwide Risk-Based International Equity ETF,P, ,Y,100.0,N,,RBIN,RBIN,N
Y,RBUS,Nationwide Risk-Based U.S. Equity ETF,P, ,Y,100.0,N,,RBUS,RBUS,N
Y,RCD,Invesco S&P 500 Equal Weight Consumer Discretionary ETF,P, ,Y,100.0,N,,RCD,RCD,N
Y,RDIV,Invesco Exchange-Traded Fund Trust II Invesco S&P Ultra Dividend Revenue ETF,P, ,Y,100.0,N,,RDIV,RDIV,N
Y,RDOG,ALPS ETF Trust ALPS REIT Dividend Dogs ETF,P, ,Y,100.0,N,,RDOG,RDOG,N
Y,RDVY,First Trust Rising Dividend Achievers ETF,Q,G,Y,100.0,N,N,,RDVY,N
Y,RECS,Columbia Research Enhanced Core ETF,P, ,Y,100.0,N,,RECS,RECS,N
Y,REET,iShares Trust iShares Global REIT ETF,P, ,Y,100.0,N,,REET,REET,N
Y,REGL,ProShares S&P MidCap 400 Dividend Aristocrats ETF,Z, ,Y,100.0,N,,REGL,REGL,N
Y,REK,ProShares Short Real Estate,P, ,Y,100.0,N,,REK,REK,N
Y,REM,iShares Trust iShares Mortgage Real Estate ETF,Z, ,Y,100.0,N,,REM,REM,N
Y,REMX,VanEck Vectors Rare Earth Strategic Metals ETF,P, ,Y,100.0,N,,REMX,REMX,N
Y,RESD,WisdomTree International ESG Fund,Z, ,Y,100.0,N,,RESD,RESD,N
Y,RESE,WisdomTree Emerging Markets ESG Fund,Z, ,Y,100.0,N,,RESE,RESE,N
Y,RETL,Direxion Daily Retail Bull 3X Shares ETF,P, ,Y,100.0,N,,RETL,RETL,N
Y,REVS,Columbia Research Enhanced Value ETF,P, ,Y,100.0,N,,REVS,REVS,N
Y,REW,ProShares UltraShort Technology,P, ,Y,100.0,N,,REW,REW,N
Y,REZ,iShares Trust iShares Residential Real Estate ETF,P, ,Y,100.0,N,,REZ,REZ,N
Y,RFAP,First Trust RiverFront Dynamic Asia Pacific ETF,Q,G,Y,100.0,N,N,,RFAP,N
Y,RFCI,RiverFront Dynamic Core Income ETF,P, ,Y,100.0,N,,RFCI,RFCI,N
Y,RFDA,RiverFront Dynamic US Dividend Advantage ETF,P, ,Y,100.0,N,,RFDA,RFDA,N
Y,RFDI,First Trust RiverFront Dynamic Developed International ETF,Q,G,Y,100.0,N,N,,RFDI,N
Y,RFEM,First Trust RiverFront Dynamic Emerging Markets ETF,Q,G,Y,100.0,N,N,,RFEM,N
Y,RFEU,First Trust RiverFront Dynamic Europe ETF,Q,G,Y,100.0,N,N,,RFEU,N
Y,RFFC,RiverFront Dynamic US Flex-Cap ETF,P, ,Y,100.0,N,,RFFC,RFFC,N
Y,RFG,Invesco S&P Midcap 400 Pure Growth ETF,P, ,Y,100.0,N,,RFG,RFG,N
Y,RFUN,RiverFront Dynamic Unconstrained Income ETF,P, ,Y,100.0,N,,RFUN,RFUN,N
Y,RFV,Invesco S&P Midcap 400 Pure Value ETF,P, ,Y,100.0,N,,RFV,RFV,N
Y,RGI,Invesco S&P 500 Equal Weight Industrials Portfolio,P, ,Y,100.0,N,,RGI,RGI,N
Y,RHS,Invesco S&P 500 Equal Weight Consumer Staples ETF  ,P, ,Y,100.0,N,,RHS,RHS,N
Y,RIGS,RiverFront Strategic Income Fund,P, ,Y,100.0,N,,RIGS,RIGS,N
Y,RINF,ProShares Inflation Expectations ETF,P, ,Y,100.0,N,,RINF,RINF,N
Y,RING,iShares MSCI Global Gold Miners ETF,Q,G,Y,100.0,N,N,,RING,N
Y,RISE,Sit Rising Rate ETF,P, ,Y,100.0,N,,RISE,RISE,N
Y,RLY,SPDR SSgA Multi Asset Real Return ETF,P, ,Y,100.0,N,,RLY,RLY,N
Y,RNDM,First Trust Developed International Equity Select ETF,Q,G,Y,100.0,N,N,,RNDM,N
Y,RNDV,First Trust US Equity Dividend Select ETF,Q,G,Y,100.0,N,N,,RNDV,N
Y,RNEM,First Trust Emerging Markets Equity Select ETF,Q,G,Y,100.0,N,N,,RNEM,N
Y,RNLC,First Trust Large Cap US Equity Select ETF,Q,G,Y,100.0,N,N,,RNLC,N
Y,RNMC,First Trust Mid Cap US Equity Select ETF,Q,G,Y,100.0,N,N,,RNMC,N
Y,RNSC,First Trust Small Cap US Equity Select ETF,Q,G,Y,100.0,N,N,,RNSC,N
Y,ROAM,Hartford Multifactor Emerging Markets ETF,P, ,Y,100.0,N,,ROAM,ROAM,N
Y,ROBO,Exchange Traded Concepts Trust ROBO Global Robotics and Automation Index ETF,P, ,Y,100.0,N,,ROBO,ROBO,N
Y,ROBT,First Trust Nasdaq Artificial Intelligence and Robotics ETF,Q,G,Y,100.0,N,N,,ROBT,N
Y,RODE,Hartford Multifactor Diversified International ETF,Z, ,Y,100.0,N,,RODE,RODE,N
Y,RODM,Hartford Multifactor Developed Markets (ex-US) ETF,P, ,Y,100.0,N,,RODM,RODM,N
Y,ROKT,SPDR S&P Kensho Final Frontiers ETF,P, ,Y,100.0,N,,ROKT,ROKT,N
Y,ROM,ProShares Ultra Technology,P, ,Y,100.0,N,,ROM,ROM,N
Y,ROMO,Strategy Shares Newfound/ReSolve Robust Momentum ETF,Z, ,Y,100.0,N,,ROMO,ROMO,N
Y,ROOF,IQ US Real Estate Small Cap ETF,P, ,Y,100.0,N,,ROOF,ROOF,N
Y,RORE,Hartford Multifactor REIT ETF,P, ,Y,100.0,N,,RORE,RORE,N
Y,ROSC,Hartford Multifactor Small Cap ETF,P, ,Y,100.0,N,,ROSC,ROSC,N
Y,ROUS,Hartford Multifactor U.S. Equity ETF,P, ,Y,100.0,N,,ROUS,ROUS,N
Y,RPAR,RPAR Risk Parity ETF,P, ,Y,100.0,N,,RPAR,RPAR,N
Y,RPG,Invesco S&P 500 Pure Growth ETF,P, ,Y,100.0,N,,RPG,RPG,N
Y,RPV,Invesco S&P 500 Pure Value ETF,P, ,Y,100.0,N,,RPV,RPV,N
Y,RSP,Invesco S&P 500 Equal Weight ETF,P, ,Y,100.0,N,,RSP,RSP,N
Y,RSX,VanEck Vectors Russia ETF,Z, ,Y,100.0,N,,RSX,RSX,N
Y,RSXJ,VanEck Vectors Russia Small-Cap ETF,Z, ,Y,100.0,N,,RSXJ,RSXJ,N
Y,RTH,VanEck Vectors Retail ETF,Q,G,Y,100.0,N,N,,RTH,N
Y,RTL,Pacer Benchmark Retail Real Estate SCTR ETF,P, ,Y,100.0,N,,RTL,RTL,N
Y,RTM,Invesco S&P 500 Equal Weight Materials ETF,P, ,Y,100.0,N,,RTM,RTM,N
Y,RUSL,Direxion Daily Russia Bull 2X Shares,P, ,Y,100.0,N,,RUSL,RUSL,N
Y,RVNU,Xtrackers Municipal Infrastructure Revenue Bond ETF,P, ,Y,100.0,N,,RVNU,RVNU,N
Y,RVRS,Reverse Cap Weighted US Large Cap ETF ,Z, ,Y,100.0,N,,RVRS,RVRS,N
Y,RWCD,Direxion MSCI Cyclicals Over Defensives ETF,P, ,Y,100.0,N,,RWCD,RWCD,N
Y,RWDC,Direxion MSCI Defensives Over Cyclicals ETF,P, ,Y,100.0,N,,RWDC,RWDC,N
Y,RWDE,Direxion MSCI Developed Over Emerging Markets ETF,P, ,Y,100.0,N,,RWDE,RWDE,N
Y,RWED,Direxion MSCI Emerging Over Developed Markets ETF,P, ,Y,100.0,N,,RWED,RWED,N
Y,RWGV,Direxion Russell 1000 Growth Over Value ETF,P, ,Y,100.0,N,,RWGV,RWGV,N
Y,RWIU,Direxion FTSE Russell International Over US ETF,P, ,Y,100.0,N,,RWIU,RWIU,N
Y,RWJ,Invesco Exchange-Traded Fund Trust II Invesco S&P SmallCap 600 Revenue ETF,P, ,Y,100.0,N,,RWJ,RWJ,N
Y,RWK,Invesco Exchange-Traded Fund Trust II Invesco S&P MidCap 400 Revenue ETF,P, ,Y,100.0,N,,RWK,RWK,N
Y,RWL,Invesco Exchange-Traded Fund Trust II Invesco S&P 500 Revenue ETF,P, ,Y,100.0,N,,RWL,RWL,N
Y,RWLS,Direxion Russell Large Over Small Cap ETF,P, ,Y,100.0,N,,RWLS,RWLS,N
Y,RWM,ProShares Short Russell2000,P, ,Y,100.0,N,,RWM,RWM,N
Y,RWO,SPDR DJ Wilshire Global Real Estate ETF,P, ,Y,100.0,N,,RWO,RWO,N
Y,RWR,SPDR DJ Wilshire REIT ETF,P, ,Y,100.0,N,,RWR,RWR,N
Y,RWSL,Direxion Russell Small Over Large Cap ETF,P, ,Y,100.0,N,,RWSL,RWSL,N
Y,RWUI,Direxion FTSE Russell US Over International ETF,P, ,Y,100.0,N,,RWUI,RWUI,N
Y,RWVG,Direxion Russell 1000 Value Over Growth ETF,P, ,Y,100.0,N,,RWVG,RWVG,N
Y,RWX,SPDR DJ Wilshire Intl Real Estate,P, ,Y,100.0,N,,RWX,RWX,N
Y,RXD,ProShares UltraShort Health Care,P, ,Y,100.0,N,,RXD,RXD,N
Y,RXI,iShares Global Consumer Discretionary ETF,P, ,Y,100.0,N,,RXI,RXI,N
Y,RXL,ProShares Ultra Health Care,P, ,Y,100.0,N,,RXL,RXL,N
Y,RYE,Invesco S&P 500 Equal Weight Energy ETF,P, ,Y,100.0,N,,RYE,RYE,N
Y,RYF,Invesco S&P 500 Equal Weight Financial ETF,P, ,Y,100.0,N,,RYF,RYF,N
Y,RYH,Invesco S&P 500 Equal Weight Health Care ETF,P, ,Y,100.0,N,,RYH,RYH,N
Y,RYJ,Invesco Raymond James SB-1 Equity ETF,P, ,Y,100.0,N,,RYJ,RYJ,N
Y,RYLD,Global X Russell 2000 Covered Call ETF,Z, ,Y,100.0,N,,RYLD,RYLD,N
Y,RYT,Invesco S&P 500 Equal Weight Technology ETF,P, ,Y,100.0,N,,RYT,RYT,N
Y,RYU,Invesco S&P 500 Equal Weight Utilities ETF,P, ,Y,100.0,N,,RYU,RYU,N
Y,RYZZ,RYZZ Managed Futures Strategy Plus ETF,P, ,Y,100.0,N,,RYZZ,RYZZ,N
Y,RZG,Invesco S&P Smallcap 600 Pure Growth ETF,P, ,Y,100.0,N,,RZG,RZG,N
Y,RZV,Invesco S&P Smallcap 600 Pure Value ETF,P, ,Y,100.0,N,,RZV,RZV,N
Y,SAA,ProShares Ultra SmallCap600,P, ,Y,100.0,N,,SAA,SAA,N
Y,SBB,ProShares Short SmallCap600,P, ,Y,100.0,N,,SBB,SBB,N
Y,SBIO,ALPS Medical Breakthroughs ETF,P, ,Y,100.0,N,,SBIO,SBIO,N
Y,SBM,Short Basic Materials,P, ,Y,100.0,N,,SBM,SBM,N
Y,SCAP,AdvisorShares Cornerstone Small Cap ETF,P, ,Y,100.0,N,,SCAP,SCAP,N
Y,SCC,ProShares UltraShort Consumer Services,P, ,Y,100.0,N,,SCC,SCC,N
Y,SCHA,Schwab U.S. Small-Cap ETF,P, ,Y,100.0,N,,SCHA,SCHA,N
Y,SCHB,Schwab U.S. Broad Market ETF,P, ,Y,100.0,N,,SCHB,SCHB,N
Y,SCHC,Schwab International Small-Cap Equity ETF,P, ,Y,100.0,N,,SCHC,SCHC,N
Y,SCHD,Schwab US Dividend Equity ETF,P, ,Y,100.0,N,,SCHD,SCHD,N
Y,SCHE,Schwab Emerging Markets Equity ETF,P, ,Y,100.0,N,,SCHE,SCHE,N
Y,SCHF,Schwab International Equity ETF,P, ,Y,100.0,N,,SCHF,SCHF,N
Y,SCHG,Schwab U.S. Large-Cap Growth ETF,P, ,Y,100.0,N,,SCHG,SCHG,N
Y,SCHH,Schwab U.S. REIT ETF,P, ,Y,100.0,N,,SCHH,SCHH,N
Y,SCHI,Schwab 5-10 Year Corporate Bond ETF,P, ,Y,100.0,N,,SCHI,SCHI,N
Y,SCHJ,Schwab 1-5 Year Corporate Bond ETF,P, ,Y,100.0,N,,SCHJ,SCHJ,N
Y,SCHK,Schwab 1000 Index ETF,P, ,Y,100.0,N,,SCHK,SCHK,N
Y,SCHM,Schwab U.S. Mid Cap ETF,P, ,Y,100.0,N,,SCHM,SCHM,N
Y,SCHO,Schwab Short-Term U.S. Treasury ETF,P, ,Y,100.0,N,,SCHO,SCHO,N
Y,SCHP,Schwab U.S. TIPs ETF,P, ,Y,100.0,N,,SCHP,SCHP,N
Y,SCHQ,Schwab Long-Term U.S. Treasury ETF,P, ,Y,100.0,N,,SCHQ,SCHQ,N
Y,SCHR,Schwab Intermediate-Term U.S. Treasury ETF,P, ,Y,100.0,N,,SCHR,SCHR,N
Y,SCHV,Schwab U.S. Large-Cap Value ETF,P, ,Y,100.0,N,,SCHV,SCHV,N
Y,SCHX,Schwab U.S. Large-Cap ETF,P, ,Y,100.0,N,,SCHX,SCHX,N
Y,SCHZ,Schwab US Aggregate Bond ETF,P, ,Y,100.0,N,,SCHZ,SCHZ,N
Y,SCID,Global X Scientific Beta Europe ETF,P, ,Y,100.0,N,,SCID,SCID,N
Y,SCIF,VanEck Vectors India Small-Cap Index ETF,P, ,Y,100.0,N,,SCIF,SCIF,N
Y,SCIJ,Global X Scientific Beta Japan ETF,P, ,Y,100.0,N,,SCIJ,SCIJ,N
Y,SCIU,Global X Scientific Beta US ETF,P, ,Y,100.0,N,,SCIU,SCIU,N
Y,SCIX,Global X Scientific Beta Asia ex-Japan ETF,P, ,Y,100.0,N,,SCIX,SCIX,N
Y,SCJ,iShares MSCI Japan Sm Cap,P, ,Y,100.0,N,,SCJ,SCJ,N
Y,SCO,ProShares UltraShort Bloomberg Crude Oil,P, ,Y,100.0,N,,SCO,SCO,N
Y,SCZ,iShares MSCI EAFE Small-Cap ETF,Q,G,Y,100.0,N,N,,SCZ,N
Y,SDAG,IQ Short Duration Enhanced Core Bond U.S. ETF,P, ,Y,100.0,N,,SDAG,SDAG,N
Y,SDCI,USCF SummerHaven Dynamic Commodity Strategy No K-1 Fund,P, ,Y,100.0,N,,SDCI,SDCI,N
Y,SDD,ProShares UltraShort SmallCap600,P, ,Y,100.0,N,,SDD,SDD,N
Y,SDEM,Global X MSCI SuperDividend Emerging Markets ETF,P, ,Y,100.0,N,,SDEM,SDEM,N
Y,SDG,iShares MSCI Global Impact ETF,Q,G,Y,100.0,N,N,,SDG,N
Y,SDGA,Impact Shares Sustainable Development Goals Global Equity ETF,P, ,Y,100.0,N,,SDGA,SDGA,N
Y,SDIV,Global X SuperDividend ETF,P, ,Y,100.0,N,,SDIV,SDIV,N
Y,SDOG,ALPS Sector Dividend Dogs ETF,P, ,Y,100.0,N,,SDOG,SDOG,N
Y,SDOW,UltraPro Short Dow30,P, ,Y,100.0,N,,SDOW,SDOW,N
Y,SDP,ProShares UltraShort Utilities,P, ,Y,100.0,N,,SDP,SDP,N
Y,SDS,ProShares UltraShort S&P500,P, ,Y,100.0,N,,SDS,SDS,N
Y,SDVY,First Trust SMID Cap Rising Dividend Achievers ETF,Q,G,Y,100.0,N,N,,SDVY,N
Y,SDY,SPDR S&P Dividend ETF,P, ,Y,100.0,N,,SDY,SDY,N
Y,SECT,Northern Lights Fund Trust IV Main Sector Rotation ETF,Z, ,Y,100.0,N,,SECT,SECT,N
Y,SEF,ProShares Short Financials,P, ,Y,100.0,N,,SEF,SEF,N
Y,SEIX,Virtus Seix Senior Loan ETF,P, ,Y,100.0,N,,SEIX,SEIX,N
Y,SFHY,WisdomTree U.S. Short Term High Yield Corporate Bond Fund,Z, ,Y,100.0,N,,SFHY,SFHY,N
Y,SFIG,WisdomTree U.S. Short Term Corporate Bond Fund,Z, ,Y,100.0,N,,SFIG,SFIG,N
Y,SFY,SoFi Select 500 ETF,P, ,Y,100.0,N,,SFY,SFY,N
Y,SFYF,SoFi 50 ETF,P, ,Y,100.0,N,,SFYF,SFYF,N
Y,SFYX,SoFi Next 500 ETF,P, ,Y,100.0,N,,SFYX,SFYX,N
Y,SGDJ,Sprott Junior Gold Miners ETF,P, ,Y,100.0,N,,SGDJ,SGDJ,N
Y,SGDM,Sprott Gold Miners ETF,P, ,Y,100.0,N,,SGDM,SGDM,N
Y,SGOL,Aberdeen Standard Physical Gold Shares ETF,P, ,Y,100.0,N,,SGOL,SGOL,N
Y,SH,ProShares Short S&P500,P, ,Y,100.0,N,,SH,SH,N
Y,SHAG,WisdomTree Yield Enhanced U.S. Short-Term Aggregate Bond Fund,Z, ,Y,100.0,N,,SHAG,SHAG,N
Y,SHE,SPDR Series Trust SPDR SSGA Gender Diversity Index ETF,P, ,Y,100.0,N,,SHE,SHE,N
Y,SHM,SPDR Nuveen Bloomberg Barclays Short Term Municipal Bond ETF,P, ,Y,100.0,N,,SHM,SHM,N
Y,SHV,iShares Short Treasury Bond ETF,Q,G,Y,100.0,N,N,,SHV,N
Y,SHY,iShares 1-3 Year Treasury Bond ETF,Q,G,Y,100.0,N,N,,SHY,N
Y,SHYD,VanEck Vectors Short High-Yield Municipal Index ETF,Z, ,Y,100.0,N,,SHYD,SHYD,N
Y,SHYG,iShares 0-5 Year High Yield Corporate Bond ETF,P, ,Y,100.0,N,,SHYG,SHYG,N
Y,SHYL,Xtrackers Short Duration High Yield Bond ETF,P, ,Y,100.0,N,,SHYL,SHYL,N
Y,SIJ,ProShares UltraShort Industrials,P, ,Y,100.0,N,,SIJ,SIJ,N
Y,SIL,Global X Silver Miners ETF,P, ,Y,100.0,N,,SIL,SIL,N
Y,SILJ,ETFMG Prime Junior Silver Miners ETF,P, ,Y,100.0,N,,SILJ,SILJ,N
Y,SIMS,SPDR S&P Kensho Intelligent Structures ETF ,P, ,Y,100.0,N,,SIMS,SIMS,N
Y,SIVR,Aberdeen Standard Physical Silver Shares ETF,P, ,Y,100.0,N,,SIVR,SIVR,N
Y,SIZE,iShares Edge MSCI USA Size Factor ETF,P, ,Y,100.0,N,,SIZE,SIZE,N
Y,SJB,ProShares Short High Yield,P, ,Y,100.0,N,,SJB,SJB,N
Y,SJNK,SPDR Bloomberg Barclays Short Term High Yield Bond ETF,P, ,Y,100.0,N,,SJNK,SJNK,N
Y,SKF,ProShares UltraShort Financials,P, ,Y,100.0,N,,SKF,SKF,N
Y,SKOR,FlexShares Credit-Scored US Corporate Bond Index Fund,Q,G,Y,100.0,N,N,,SKOR,N
Y,SKYY,First Trust Cloud Computing ETF,Q,G,Y,100.0,N,N,,SKYY,N
Y,SLQD,iShares 0-5 Year Investment Grade Corporate Bond ETF,Q,G,Y,100.0,N,N,,SLQD,N
Y,SLT,Salt High truBeta US Market ETF,Z, ,Y,100.0,N,,SLT,SLT,N
Y,SLV,iShares Silver Trust,P, ,Y,100.0,N,,SLV,SLV,N
Y,SLVP,iShares MSCI Global Silver Miners Fund,Z, ,Y,100.0,N,,SLVP,SLVP,N
Y,SLX,VanEck Vectors Steel ETF ,P, ,Y,100.0,N,,SLX,SLX,N
Y,SLY,SPDR S&P 600 Small Cap ETF (based on S&P SmallCap 600 Index -- symbol SML),P, ,Y,100.0,N,,SLY,SLY,N
Y,SLYG,SPDR S&P 600 Small Cap Growth ETF (based on S&P SmallCap 600 Growth Index --symbol CGK),P, ,Y,100.0,N,,SLYG,SLYG,N
Y,SLYV,SPDR S&P 600 Small Cap Value ETF (based on S&P SmallCap Value Index--symbol--CVK,P, ,Y,100.0,N,,SLYV,SLYV,N
Y,SMB,VanEck Vectors AMT-Free Short Municipal Index ETF,Z, ,Y,100.0,N,,SMB,SMB,N
Y,SMCP,AlphaMark Actively Managed Small Cap ETF,Q,G,Y,100.0,N,N,,SMCP,N
Y,SMDD,UltraPro Short MidCap400,P, ,Y,100.0,N,,SMDD,SMDD,N
Y,SMDV,ProShares Russell 2000 Dividend Growers ETF,Z, ,Y,100.0,N,,SMDV,SMDV,N
Y,SMDY,Syntax Stratified MidCap ETF,P, ,Y,100.0,N,,SMDY,SMDY,N
Y,SMEZ,SPDR EURO STOXX Small Cap ETF,P, ,Y,100.0,N,,SMEZ,SMEZ,N
Y,SMH,VanEck Vectors Semiconductor ETF,Q,G,Y,100.0,N,N,,SMH,N
Y,SMIN,Ishares MSCI India Small Cap ETF,Z, ,Y,100.0,N,,SMIN,SMIN,N
Y,SMLF,iShares Edge MSCI Multifactor USA Small-Cap ETF,P, ,Y,100.0,N,,SMLF,SMLF,N
Y,SMLL,Direxion Daily Small Cap Bull 2X Shares,P, ,Y,100.0,N,,SMLL,SMLL,N
Y,SMLV,SPDR SSGA US Small Cap Low Volatility Index ETF,P, ,Y,100.0,N,,SMLV,SMLV,N
Y,SMMD,iShares Trust iShares Russell 2500 ETF,Z, ,Y,100.0,N,,SMMD,SMMD,N
Y,SMMU,Short Term Municipal Bond Active Exchange-Traded Fund,P, ,Y,100.0,N,,SMMU,SMMU,N
Y,SMMV,iShares Trust ETF,Z, ,Y,100.0,N,,SMMV,SMMV,N
Y,SMN,ProShares UltraShort Basic Materials,P, ,Y,100.0,N,,SMN,SMN,N
Y,SMOG,VanEck Vectors Low Carbon Energy ETF,P, ,Y,100.0,N,,SMOG,SMOG,N
Y,SNLN,Highland/iBoxx Senior Loan ETF,Q,G,Y,100.0,N,N,,SNLN,N
Y,SNPE,Xtrackers S&P 500 ESG ETF,P, ,Y,100.0,N,,SNPE,SNPE,N
Y,SNSR,Global X Internet of Things ETF,Q,G,Y,100.0,N,N,,SNSR,N
Y,SNUG,Merlyn.AI Tactical Growth & Income ETF,Q,G,Y,100.0,N,N,,SNUG,N
Y,SOCL,Global X Social Media ETF,Q,G,Y,100.0,N,N,,SOCL,N
Y,SOIL,Global X Fertilizers/Potash ETF,P, ,Y,100.0,N,,SOIL,SOIL,N
Y,SOVB,Cambria Sovereign Bond ETF,Z, ,Y,100.0,N,,SOVB,SOVB,N
Y,SOXL,Direxion Daily Semiconductor Bull 3x Shares,P, ,Y,100.0,N,,SOXL,SOXL,N
Y,SOXS,Direxion Daily Semiconductor Bear 3x Shares,P, ,Y,100.0,N,,SOXS,SOXS,N
Y,SOXX,iShares PHLX SOX Semiconductor Sector Index Fund,Q,G,Y,100.0,N,N,,SOXX,N
Y,SOYB,Teucrium Soybean Fund ETV,P, ,Y,100.0,N,,SOYB,SOYB,N
Y,SPAB,SPDR Portfolio Aggregate Bond ETF,P, ,Y,100.0,N,,SPAB,SPAB,N
Y,SPBO,SPDR Portfolio Corporate Bond ETF,P, ,Y,100.0,N,,SPBO,SPBO,N
Y,SPDN,Direxion Daily S&P 500 Bear 1X Shares,P, ,Y,100.0,N,,SPDN,SPDN,N
Y,SPDV,AAM S&P 500 High Dividend Value ETF,P, ,Y,100.0,N,,SPDV,SPDV,N
Y,SPDW,SPDR Portfolio Developed World ex-US ETF,P, ,Y,100.0,N,,SPDW,SPDW,N
Y,SPEM,SPDR Index Shares Fund SPDR Portfolio Emerging Markets ETF,P, ,Y,100.0,N,,SPEM,SPEM,N
Y,SPEU,SPDR Portfolio Europe ETF,P, ,Y,100.0,N,,SPEU,SPEU,N
Y,SPFF,Global X SuperIncome Preferred ETF,P, ,Y,100.0,N,,SPFF,SPFF,N
Y,SPGM,SPDR Portfolio MSCI Global Stock Market ETF,P, ,Y,100.0,N,,SPGM,SPGM,N
Y,SPGP,Invesco S&P 500 GARP ETF,P, ,Y,100.0,N,,SPGP,SPGP,N
Y,SPHB,Invesco S&P 500 High Beta ETF,P, ,Y,100.0,N,,SPHB,SPHB,N
Y,SPHD,Invesco S&P 500 High Dividend Low Volatility ETF,P, ,Y,100.0,N,,SPHD,SPHD,N
Y,SPHQ,Invesco S&P 500 Quality ETF,P, ,Y,100.0,N,,SPHQ,SPHQ,N
Y,SPHY,SPDR Portfolio High Yield Bond ETF,P, ,Y,100.0,N,,SPHY,SPHY,N
Y,SPIB,SPDR Portfolio Intermediate Term Corporate Bond ETF,P, ,Y,100.0,N,,SPIB,SPIB,N
Y,SPIP,SPDR Portfolio TIPS ETF,P, ,Y,100.0,N,,SPIP,SPIP,N
Y,SPLB,SPDR Portfolio Long Term Corporate Bond ETF,P, ,Y,100.0,N,,SPLB,SPLB,N
Y,SPLG,SPDR Portfolio S&P 500 ETF,P, ,Y,100.0,N,,SPLG,SPLG,N
