Nasdaq Traded,Symbol,Security Name,Listing Exchange,Market Category,ETF,Round Lot Size,Test Issue,Financial Status,CQS Symbol,NASDAQ Symbol,NextShares,Industry,Source
Y,AA,Alcoa Corporation Common Stock ,N, ,N,100.0,N,,AA,AA,N,Basic Materials,Yahoo Finance
Y,AEM,Agnico Eagle Mines Limited Common Stock,N, ,N,100.0,N,,AEM,AEM,N,Basic Materials,Yahoo Finance
Y,AG,First Majestic Silver Corp. Ordinary Shares (Canada),N, ,N,100.0,N,,AG,AG,N,Basic Materials,Yahoo Finance
Y,AGI,Alamos Gold Inc. Class A Common Shares,N, ,N,100.0,N,,AGI,AGI,N,Basic Materials,Yahoo Finance
Y,ALB,Albemarle Corporation Common Stock,N, ,N,100.0,N,,ALB,ALB,N,Basic Materials,Yahoo Finance
Y,AMTX,"Aemetis, Inc - Common Stock",Q,G,N,100.0,N,D,,AMTX,N,Basic Materials,Yahoo Finance
Y,APD,"Air Products and Chemicals, Inc. Common Stock",N, ,N,100.0,N,,APD,APD,N,Basic Materials,Yahoo Finance
Y,AREC,American Resources Corporation - Class A Common Stock,Q,S,N,100.0,N,D,,AREC,N,Basic Materials,Yahoo Finance
Y,ASH,Ashland Global Holdings Inc. Common Stock,N, ,N,100.0,N,,ASH,ASH,N,Basic Materials,Yahoo Finance
Y,ASIX,AdvanSix Inc. Common Stock ,N, ,N,100.0,N,,ASIX,ASIX,N,Basic Materials,Yahoo Finance
Y,ASM,Avino Silver & Gold Mines Ltd. Common Shares (Canada),A, ,N,100.0,N,,ASM,ASM,N,Basic Materials,Yahoo Finance
Y,AU,AngloGold Ashanti Limited Common Stock,N, ,N,100.0,N,,AU,AU,N,Basic Materials,Yahoo Finance
Y,AUMN,Golden Minerals Company Common Stock,A, ,N,100.0,N,,AUMN,AUMN,N,Basic Materials,Yahoo Finance
Y,AVD,American Vanguard Corporation Common Stock ($0.10 Par Value),N, ,N,100.0,N,,AVD,AVD,N,Basic Materials,Yahoo Finance
Y,AXTA,Axalta Coating Systems Ltd. Common Shares,N, ,N,100.0,N,,AXTA,AXTA,N,Basic Materials,Yahoo Finance
Y,B,"Barnes Group, Inc. Common Stock",N, ,N,100.0,N,,B,B,N,Basic Materials,Yahoo Finance
Y,BAK,Braskem SA ADR,N, ,N,100.0,N,,BAK,BAK,N,Basic Materials,Yahoo Finance
Y,BCC,"Boise Cascade, L.L.C. Common Stock",N, ,N,100.0,N,,BCC,BCC,N,Basic Materials,Yahoo Finance
Y,BCPC,Balchem Corporation - Common Stock,Q,Q,N,100.0,N,N,,BCPC,N,Basic Materials,Yahoo Finance
Y,BHP,BHP Group Limited American Depositary Shares (Each representing two Ordinary Shares),N, ,N,100.0,N,,BHP,BHP,N,Basic Materials,Yahoo Finance
Y,BIOX,Bioceres Crop Solutions Corp. Ordinary Shares,A, ,N,100.0,N,,BIOX,BIOX,N,Basic Materials,Yahoo Finance
Y,BTG,B2Gold Corp Common shares (Canada),A, ,N,100.0,N,,BTG,BTG,N,Basic Materials,Yahoo Finance
Y,BVN,Buenaventura Mining Company Inc.,N, ,N,100.0,N,,BVN,BVN,N,Basic Materials,Yahoo Finance
Y,CBT,Cabot Corporation Common Stock,N, ,N,100.0,N,,CBT,CBT,N,Basic Materials,Yahoo Finance
Y,CC,Chemours Company (The) Common Stock,N, ,N,100.0,N,,CC,CC,N,Basic Materials,Yahoo Finance
Y,CDE,"Coeur Mining, Inc. Common Stock",N, ,N,100.0,N,,CDE,CDE,N,Basic Materials,Yahoo Finance
Y,CE,Celanese Corporation Celanese Corporation Common Stock,N, ,N,100.0,N,,CE,CE,N,Basic Materials,Yahoo Finance
Y,CENX,Century Aluminum Company - Common Stock,Q,Q,N,100.0,N,N,,CENX,N,Basic Materials,Yahoo Finance
Y,CF,"CF Industries Holdings, Inc. Common Stock",N, ,N,100.0,N,,CF,CF,N,Basic Materials,Yahoo Finance
Y,CHNR,"China Natural Resources, Inc. - Common Stock",Q,S,N,100.0,N,D,,CHNR,N,Basic Materials,Yahoo Finance
Y,CLF,Cleveland-Cliffs Inc. Common Stock,N, ,N,100.0,N,,CLF,CLF,N,Basic Materials,Yahoo Finance
Y,CLMT,"Calumet Specialty Products Partners, L.P. - Common units representing limited partner interests",Q,Q,N,100.0,N,N,,CLMT,N,Basic Materials,Yahoo Finance
Y,CLW,Clearwater Paper Corporation Common Stock,N, ,N,100.0,N,,CLW,CLW,N,Basic Materials,Yahoo Finance
Y,CMC,Commercial Metals Company Common Stock,N, ,N,100.0,N,,CMC,CMC,N,Basic Materials,Yahoo Finance
Y,CMCL,Caledonia Mining Corporation Plc Common Shares,A, ,N,100.0,N,,CMCL,CMCL,N,Basic Materials,Yahoo Finance
Y,CMP,Compass Minerals Intl Inc Common Stock,N, ,N,100.0,N,,CMP,CMP,N,Basic Materials,Yahoo Finance
Y,CMT,Core Molding Technologies Inc Common Stock,A, ,N,100.0,N,,CMT,CMT,N,Basic Materials,Yahoo Finance
Y,CPAC,Cementos Pacasmayo S.A.A. American Depositary Shares (Each representing five Common Shares),N, ,N,100.0,N,,CPAC,CPAC,N,Basic Materials,Yahoo Finance
Y,CRH,CRH PLC American Depositary Shares,N, ,N,100.0,N,,CRH,CRH,N,Basic Materials,Yahoo Finance
Y,CSTM,Constellium SE Ordinary Shares (France),N, ,N,100.0,N,,CSTM,CSTM,N,Basic Materials,Yahoo Finance
Y,CTVA,"Corteva, Inc. Common Stock ",N, ,N,100.0,N,,CTVA,CTVA,N,Basic Materials,Yahoo Finance
Y,CX,"Cemex, S.A.B. de C.V. Sponsored ADR",N, ,N,100.0,N,,CX,CX,N,Basic Materials,Yahoo Finance
Y,DD,"DuPont de Nemours, Inc. Common Stock",N, ,N,100.0,N,,DD,DD,N,Basic Materials,Yahoo Finance
Y,DOW,Dow Inc. Common Stock ,N, ,N,100.0,N,,DOW,DOW,N,Basic Materials,Yahoo Finance
Y,DRD,DRDGOLD Limited American Depositary Shares,N, ,N,100.0,N,,DRD,DRD,N,Basic Materials,Yahoo Finance
Y,ECL,Ecolab Inc. Common Stock,N, ,N,100.0,N,,ECL,ECL,N,Basic Materials,Yahoo Finance
Y,EGO,Eldorado Gold Corporation Ordinary Shares,N, ,N,100.0,N,,EGO,EGO,N,Basic Materials,Yahoo Finance
Y,EMN,Eastman Chemical Company Common Stock,N, ,N,100.0,N,,EMN,EMN,N,Basic Materials,Yahoo Finance
Y,EMX,EMX Royalty Corporation Common Shares (Canada),A, ,N,100.0,N,,EMX,EMX,N,Basic Materials,Yahoo Finance
Y,EQX,Equinox Gold Corp. Common Shares,A, ,N,100.0,N,,EQX,EQX,N,Basic Materials,Yahoo Finance
Y,ESI,Element Solutions Inc. Common Stock,N, ,N,100.0,N,,ESI,ESI,N,Basic Materials,Yahoo Finance
Y,EXK,Endeavour Silver Corporation Ordinary Shares (Canada),N, ,N,100.0,N,,EXK,EXK,N,Basic Materials,Yahoo Finance
Y,EXP,Eagle Materials Inc Common Stock,N, ,N,100.0,N,,EXP,EXP,N,Basic Materials,Yahoo Finance
Y,FCX,"Freeport-McMoRan, Inc. Common Stock",N, ,N,100.0,N,,FCX,FCX,N,Basic Materials,Yahoo Finance
Y,FF,FutureFuel Corp.  Common shares,N, ,N,100.0,N,,FF,FF,N,Basic Materials,Yahoo Finance
Y,FMC,FMC Corporation Common Stock,N, ,N,100.0,N,,FMC,FMC,N,Basic Materials,Yahoo Finance
Y,FNV,Franco-Nevada Corporation,N, ,N,100.0,N,,FNV,FNV,N,Basic Materials,Yahoo Finance
Y,FRD,Friedman Industries Inc. Common Stock,A, ,N,100.0,N,,FRD,FRD,N,Basic Materials,Yahoo Finance
Y,FSI,Flexible Solutions International Inc. Common Stock (CDA),A, ,N,100.0,N,,FSI,FSI,N,Basic Materials,Yahoo Finance
Y,FSM,Fortuna Silver Mines Inc Ordinary Shares (Canada),N, ,N,100.0,N,,FSM,FSM,N,Basic Materials,Yahoo Finance
Y,FUL,H. B. Fuller Company Common Stock,N, ,N,100.0,N,,FUL,FUL,N,Basic Materials,Yahoo Finance
Y,GEVO,"Gevo, Inc. - Common Stock",Q,S,N,100.0,N,N,,GEVO,N,Basic Materials,Yahoo Finance
Y,GFI,Gold Fields Limited American Depositary Shares,N, ,N,100.0,N,,GFI,GFI,N,Basic Materials,Yahoo Finance
Y,GGB,Gerdau S.A. Common Stock,N, ,N,100.0,N,,GGB,GGB,N,Basic Materials,Yahoo Finance
Y,GORO,Gold Resource Corporation Common Stock,A, ,N,100.0,N,,GORO,GORO,N,Basic Materials,Yahoo Finance
Y,GPRE,"Green Plains, Inc. - Common Stock",Q,Q,N,100.0,N,N,,GPRE,N,Basic Materials,Yahoo Finance
Y,GSM,Ferroglobe PLC - Ordinary Shares,Q,Q,N,100.0,N,D,,GSM,N,Basic Materials,Yahoo Finance
Y,GURE,"Gulf Resources, Inc. - Common Stock",Q,Q,N,100.0,N,N,,GURE,N,Basic Materials,Yahoo Finance
Y,HBM,Hudbay Minerals Inc. Ordinary Shares (Canada),N, ,N,100.0,N,,HBM,HBM,N,Basic Materials,Yahoo Finance
Y,HCC,"Warrior Met Coal, Inc. Common Stock",N, ,N,100.0,N,,HCC,HCC,N,Basic Materials,Yahoo Finance
Y,HDSN,"Hudson Technologies, Inc. - Common Stock",Q,S,N,100.0,N,D,,HDSN,N,Basic Materials,Yahoo Finance
Y,HL,Hecla Mining Company Common Stock,N, ,N,100.0,N,,HL,HL,N,Basic Materials,Yahoo Finance
Y,HMY,Harmony Gold Mining Company Limited,N, ,N,100.0,N,,HMY,HMY,N,Basic Materials,Yahoo Finance
Y,HUN,Huntsman Corporation Common Stock,N, ,N,100.0,N,,HUN,HUN,N,Basic Materials,Yahoo Finance
Y,HWKN,"Hawkins, Inc. - Common Stock",Q,Q,N,100.0,N,N,,HWKN,N,Basic Materials,Yahoo Finance
Y,IAG,Iamgold Corporation Ordinary Shares,N, ,N,100.0,N,,IAG,IAG,N,Basic Materials,Yahoo Finance
Y,ICL,Israel Chemicals Limited Ordinary Shares,N, ,N,100.0,N,,ICL,ICL,N,Basic Materials,Yahoo Finance
Y,IFF,"Internationa Flavors & Fragrances, Inc. Common Stock",N, ,N,100.0,N,,IFF,IFF,N,Basic Materials,Yahoo Finance
Y,IOSP,Innospec Inc. - Common Stock,Q,Q,N,100.0,N,N,,IOSP,N,Basic Materials,Yahoo Finance
Y,IPI,"Intrepid Potash, Inc Common Stock",N, ,N,100.0,N,,IPI,IPI,N,Basic Materials,Yahoo Finance
Y,ITP,"IT Tech Packaging, Inc. Common Stock",A, ,N,100.0,N,,ITP,ITP,N,Basic Materials,Yahoo Finance
Y,JHX,James Hardie Industries plc American Depositary Shares (Ireland),N, ,N,100.0,N,,JHX,JHX,N,Basic Materials,Yahoo Finance
Y,KALU,Kaiser Aluminum Corporation - Common Stock,Q,Q,N,100.0,N,N,,KALU,N,Basic Materials,Yahoo Finance
Y,KGC,Kinross Gold Corporation Common Stock,N, ,N,100.0,N,,KGC,KGC,N,Basic Materials,Yahoo Finance
Y,KOP,Koppers Holdings Inc. Koppers Holdings Inc. Common Stock,N, ,N,100.0,N,,KOP,KOP,N,Basic Materials,Yahoo Finance
Y,KRO,Kronos Worldwide Inc Common Stock,N, ,N,100.0,N,,KRO,KRO,N,Basic Materials,Yahoo Finance
Y,KWR,Quaker Chemical Corporation Common Stock,N, ,N,100.0,N,,KWR,KWR,N,Basic Materials,Yahoo Finance
Y,LAC,Lithium Americas Corp. Common Shares,N, ,N,100.0,N,,LAC,LAC,N,Basic Materials,Yahoo Finance
Y,LIN,Linde plc Ordinary Share,N, ,N,100.0,N,,LIN,LIN,N,Basic Materials,Yahoo Finance
Y,LODE,"Comstock Mining, Inc. Common Stock",A, ,N,100.0,N,,LODE,LODE,N,Basic Materials,Yahoo Finance
Y,LOMA,Loma Negra Compania Industrial Argentina Sociedad Anonima ADS,N, ,N,100.0,N,,LOMA,LOMA,N,Basic Materials,Yahoo Finance
Y,LOOP,"Loop Industries, Inc. - Common Stock",Q,G,N,100.0,N,N,,LOOP,N,Basic Materials,Yahoo Finance
Y,LXU,"LSB Industries, Inc. Common Stock",N, ,N,100.0,N,,LXU,LXU,N,Basic Materials,Yahoo Finance
Y,LYB,LyondellBasell Industries NV Ordinary Shares Class A (Netherlands),N, ,N,100.0,N,,LYB,LYB,N,Basic Materials,Yahoo Finance
Y,MAG,MAG Silver Corporation Ordinary Shares,A, ,N,100.0,N,,MAG,MAG,N,Basic Materials,Yahoo Finance
Y,MEOH,Methanex Corporation - Common Stock,Q,Q,N,100.0,N,N,,MEOH,N,Basic Materials,Yahoo Finance
Y,MERC,Mercer International Inc. - Common Stock,Q,Q,N,100.0,N,N,,MERC,N,Basic Materials,Yahoo Finance
Y,METC,"Ramaco Resources, Inc. - Common Stock",Q,Q,N,100.0,N,N,,METC,N,Basic Materials,Yahoo Finance
Y,MLM,"Martin Marietta Materials, Inc. Common Stock",N, ,N,100.0,N,,MLM,MLM,N,Basic Materials,Yahoo Finance
Y,MOS,Mosaic Company (The) Common Stock,N, ,N,100.0,N,,MOS,MOS,N,Basic Materials,Yahoo Finance
Y,MSB,Mesabi Trust Common Stock,N, ,N,100.0,N,,MSB,MSB,N,Basic Materials,Yahoo Finance
Y,MT,Arcelor Mittal NY Registry Shares NEW,N, ,N,100.0,N,,MT,MT,N,Basic Materials,Yahoo Finance
Y,MTA,Metalla Royalty & Streaming Ltd. Common Shares,A, ,N,100.0,N,,MTA,MTA,N,Basic Materials,Yahoo Finance
Y,MTRN,Materion Corporation,N, ,N,100.0,N,,MTRN,MTRN,N,Basic Materials,Yahoo Finance
Y,MTX,Minerals Technologies Inc. Common Stock,N, ,N,100.0,N,,MTX,MTX,N,Basic Materials,Yahoo Finance
Y,MUX,McEwen Mining Inc. Common Stock,N, ,N,100.0,N,,MUX,MUX,N,Basic Materials,Yahoo Finance
Y,NAK,"Northern Dynasty Minerals, Ltd. Common Stock",A, ,N,100.0,N,,NAK,NAK,N,Basic Materials,Yahoo Finance
Y,NEM,Newmont Corporation,N, ,N,100.0,N,,NEM,NEM,N,Basic Materials,Yahoo Finance
Y,NEU,NewMarket Corp Common Stock,N, ,N,100.0,N,,NEU,NEU,N,Basic Materials,Yahoo Finance
Y,NEXA,Nexa Resources S.A. Common Shares,N, ,N,100.0,N,,NEXA,NEXA,N,Basic Materials,Yahoo Finance
Y,NG,Novagold Resources Inc.,A, ,N,100.0,N,,NG,NG,N,Basic Materials,Yahoo Finance
Y,NGD,New Gold Inc.,A, ,N,100.0,N,,NGD,NGD,N,Basic Materials,Yahoo Finance
Y,NGVT,Ingevity Corporation Common Stock ,N, ,N,100.0,N,,NGVT,NGVT,N,Basic Materials,Yahoo Finance
Y,NTIC,Northern Technologies International Corporation - Common Stock,Q,G,N,100.0,N,N,,NTIC,N,Basic Materials,Yahoo Finance
Y,NTR,Nutrien Ltd. Common Shares,N, ,N,100.0,N,,NTR,NTR,N,Basic Materials,Yahoo Finance
Y,NUE,Nucor Corporation Common Stock,N, ,N,100.0,N,,NUE,NUE,N,Basic Materials,Yahoo Finance
Y,NWPX,Northwest Pipe Company - Common Stock,Q,Q,N,100.0,N,N,,NWPX,N,Basic Materials,Yahoo Finance
Y,ODC,Oil-Dri Corporation Of America Common Stock,N, ,N,100.0,N,,ODC,ODC,N,Basic Materials,Yahoo Finance
Y,OEC,Orion Engineered Carbons S.A Common Shares,N, ,N,100.0,N,,OEC,OEC,N,Basic Materials,Yahoo Finance
Y,OLN,Olin Corporation Common Stock,N, ,N,100.0,N,,OLN,OLN,N,Basic Materials,Yahoo Finance
Y,OMEX,"Odyssey Marine Exploration, Inc. - Common Stock",Q,S,N,100.0,N,N,,OMEX,N,Basic Materials,Yahoo Finance
Y,OR,Osisko Gold Royalties Ltd Common Shares,N, ,N,100.0,N,,OR,OR,N,Basic Materials,Yahoo Finance
Y,PAAS,Pan American Silver Corp. - Common Stock,Q,Q,N,100.0,N,N,,PAAS,N,Basic Materials,Yahoo Finance
Y,PKX,POSCO Common Stock,N, ,N,100.0,N,,PKX,PKX,N,Basic Materials,Yahoo Finance
Y,PLG,Platinum Group Metals Ltd. Ordinary Shares (Canada),A, ,N,100.0,N,,PLG,PLG,N,Basic Materials,Yahoo Finance
Y,PPG,"PPG Industries, Inc. Common Stock",N, ,N,100.0,N,,PPG,PPG,N,Basic Materials,Yahoo Finance
Y,PZG,Paramount Gold Nevada Corp. Common Stock,A, ,N,100.0,N,,PZG,PZG,N,Basic Materials,Yahoo Finance
Y,RETO,"ReTo Eco-Solutions, Inc. - Common Shares",Q,S,N,100.0,N,D,,RETO,N,Basic Materials,Yahoo Finance
Y,REX,REX American Resources Corporation,N, ,N,100.0,N,,REX,REX,N,Basic Materials,Yahoo Finance
Y,RGLD,"Royal Gold, Inc. - Common Stock",Q,Q,N,100.0,N,N,,RGLD,N,Basic Materials,Yahoo Finance
Y,RIO,Rio Tinto Plc Common Stock,N, ,N,100.0,N,,RIO,RIO,N,Basic Materials,Yahoo Finance
Y,RPM,RPM International Inc. Common Stock,N, ,N,100.0,N,,RPM,RPM,N,Basic Materials,Yahoo Finance
Y,RS,Reliance Steel & Aluminum Co. Common Stock (DE),N, ,N,100.0,N,,RS,RS,N,Basic Materials,Yahoo Finance
Y,RYAM,Rayonier Advanced Materials Inc. Common Stock,N, ,N,100.0,N,,RYAM,RYAM,N,Basic Materials,Yahoo Finance
Y,SA,"Seabridge Gold, Inc. Ordinary Shares (Canada)",N, ,N,100.0,N,,SA,SA,N,Basic Materials,Yahoo Finance
Y,SAND,Sandstorm Gold Ltd. Ordinary Shares (Canada),N, ,N,100.0,N,,SAND,SAND,N,Basic Materials,Yahoo Finance
Y,SANW,S&W Seed Company - Common Stock,Q,S,N,100.0,N,N,,SANW,N,Basic Materials,Yahoo Finance
Y,SCCO,Southern Copper Corporation Common Stock,N, ,N,100.0,N,,SCCO,SCCO,N,Basic Materials,Yahoo Finance
Y,SCL,Stepan Company Common Stock,N, ,N,100.0,N,,SCL,SCL,N,Basic Materials,Yahoo Finance
Y,SEED,Origin Agritech Limited - Common Stock,Q,S,N,100.0,N,D,,SEED,N,Basic Materials,Yahoo Finance
Y,SHW,Sherwin-Williams Company (The) Common Stock,N, ,N,100.0,N,,SHW,SHW,N,Basic Materials,Yahoo Finance
Y,SID,Companhia Siderurgica Nacional S.A. Common Stock,N, ,N,100.0,N,,SID,SID,N,Basic Materials,Yahoo Finance
Y,SIM,"Grupo Simec, S.A.B. de C.V. American Depositary Shares",A, ,N,100.0,N,,SIM,SIM,N,Basic Materials,Yahoo Finance
Y,SMG,Scotts Miracle-Gro Company (The) Common Stock,N, ,N,100.0,N,,SMG,SMG,N,Basic Materials,Yahoo Finance
Y,SNES,"SenesTech, Inc. - Common Stock",Q,S,N,100.0,N,N,,SNES,N,Basic Materials,Yahoo Finance
Y,SQM,Sociedad Quimica y Minera S.A. Common Stock,N, ,N,100.0,N,,SQM,SQM,N,Basic Materials,Yahoo Finance
Y,SSD,"Simpson Manufacturing Company, Inc. Common Stock",N, ,N,100.0,N,,SSD,SSD,N,Basic Materials,Yahoo Finance
Y,SSL,Sasol Ltd. American Depositary Shares,N, ,N,100.0,N,,SSL,SSL,N,Basic Materials,Yahoo Finance
Y,SSRM,SSR Mining Inc. - Common Stock,Q,Q,N,100.0,N,N,,SSRM,N,Basic Materials,Yahoo Finance
Y,STLD,"Steel Dynamics, Inc. - Common Stock",Q,Q,N,100.0,N,N,,STLD,N,Basic Materials,Yahoo Finance
Y,SUZ,Suzano S.A. American Depositary Shares (each representing One Ordinary Share),N, ,N,100.0,N,,SUZ,SUZ,N,Basic Materials,Yahoo Finance
Y,SVM,Silvercorp Metals Inc. Common Shares,A, ,N,100.0,N,,SVM,SVM,N,Basic Materials,Yahoo Finance
Y,SXC,"SunCoke Energy, Inc. Common Stock",N, ,N,100.0,N,,SXC,SXC,N,Basic Materials,Yahoo Finance
Y,SXT,Sensient Technologies Corporation Common Stock,N, ,N,100.0,N,,SXT,SXT,N,Basic Materials,Yahoo Finance
Y,TECK,Teck Resources Ltd Ordinary Shares,N, ,N,100.0,N,,TECK,TECK,N,Basic Materials,Yahoo Finance
Y,TGB,"Taseko Mines, Ltd. Common Stock",A, ,N,100.0,N,,TGB,TGB,N,Basic Materials,Yahoo Finance
Y,TGLS,Tecnoglass Inc. - Ordinary Shares,Q,S,N,100.0,N,N,,TGLS,N,Basic Materials,Yahoo Finance
Y,THM,"International Tower Hill Mines, Ltd. Ordinary Shares (Canada)",A, ,N,100.0,N,,THM,THM,N,Basic Materials,Yahoo Finance
Y,TMQ,Trilogy Metals Inc. Common Stock,A, ,N,100.0,N,,TMQ,TMQ,N,Basic Materials,Yahoo Finance
Y,TROX,Tronox Holdings plc Ordinary Shares (UK),N, ,N,100.0,N,,TROX,TROX,N,Basic Materials,Yahoo Finance
Y,TRX,Tanzanian Gold Corporation Common Stock,A, ,N,100.0,N,,TRX,TRX,N,Basic Materials,Yahoo Finance
Y,TSE,Trinseo S.A. Ordinary Shares,N, ,N,100.0,N,,TSE,TSE,N,Basic Materials,Yahoo Finance
Y,TX,"Ternium S.A. Ternium S.A. American Depositary Shares (each representing ten shares, USD1.00 par value)",N, ,N,100.0,N,,TX,TX,N,Basic Materials,Yahoo Finance
Y,UAMY,United States Antimony Corporation Common Stock,A, ,N,100.0,N,,UAMY,UAMY,N,Basic Materials,Yahoo Finance
Y,UAN,"CVR Partners, LP Common Units representing Limited Partner Interests",N, ,N,100.0,N,,UAN,UAN,N,Basic Materials,Yahoo Finance
Y,UFPI,"Universal Forest Products, Inc. - Common Stock",Q,Q,N,100.0,N,N,,UFPI,N,Basic Materials,Yahoo Finance
Y,USAS,"Americas Gold and Silver Corporation Common Shares, no par value",A, ,N,100.0,N,,USAS,USAS,N,Basic Materials,Yahoo Finance
Y,USAU,U.S. Gold Corp. - Common Stock,Q,S,N,100.0,N,D,,USAU,N,Basic Materials,Yahoo Finance
Y,USLM,"United States Lime & Minerals, Inc. - Common Stock",Q,Q,N,100.0,N,N,,USLM,N,Basic Materials,Yahoo Finance
Y,VALE,VALE S.A.  American Depositary Shares Each Representing one common share,N, ,N,100.0,N,,VALE,VALE,N,Basic Materials,Yahoo Finance
Y,VGZ,Vista Gold Corp Common Stock,A, ,N,100.0,N,,VGZ,VGZ,N,Basic Materials,Yahoo Finance
Y,VHI,"Valhi, Inc. Common Stock",N, ,N,100.0,N,,VHI,VHI,N,Basic Materials,Yahoo Finance
Y,VMC,Vulcan Materials Company (Holding Company) Common Stock,N, ,N,100.0,N,,VMC,VMC,N,Basic Materials,Yahoo Finance
Y,WDFC,WD-40 Company - Common Stock,Q,Q,N,100.0,N,N,,WDFC,N,Basic Materials,Yahoo Finance
Y,WLK,Westlake Chemical Corporation Common Stock,N, ,N,100.0,N,,WLK,WLK,N,Basic Materials,Yahoo Finance
Y,WLKP,Westlake Chemical Partners LP Common Units representing limited partner interests,N, ,N,100.0,N,,WLKP,WLKP,N,Basic Materials,Yahoo Finance
Y,WPM,Wheaton Precious Metals Corp Common Shares (Canada),N, ,N,100.0,N,,WPM,WPM,N,Basic Materials,Yahoo Finance
Y,WRN,Western Copper and Gold Corporation Common Stock,A, ,N,100.0,N,,WRN,WRN,N,Basic Materials,Yahoo Finance
Y,WWR,"Westwater Resources, Inc. - Common Stock",Q,S,N,100.0,N,N,,WWR,N,Basic Materials,Yahoo Finance
Y,XPL,Solitario Zinc Corp. Common Stock,A, ,N,100.0,N,,XPL,XPL,N,Basic Materials,Yahoo Finance
Y,ZEUS,"Olympic Steel, Inc. - Common Stock",Q,Q,N,100.0,N,N,,ZEUS,N,Basic Materials,Yahoo Finance
Y,ZKIN,"ZK International Group Co., Ltd - Ordinary Share",Q,S,N,100.0,N,N,,ZKIN,N,Basic Materials,Yahoo Finance
